{
  "@context": ["https://www.w3.org/ns/credentials/v2", "https://pariksha-protocol.org/ctx/draft-01"],
  "type": ["VerifiableCredential", "ExamPaperCredential"],
  "id": "vc:example:paper:PKG-C012",
  "issuer": "vc:example:assembler:BOARD-authority",
  "validFrom": "2026-10-11T08:50:00+05:30",
  "validUntil": "2026-10-11T09:15:00+05:30",
  "credentialSubject": {
    "id": "vc:example:centre:C012",
    "scope": "exam:BOARD-2026-P1/centre:C012",
    "issuing_authority": "vc:example:authority:BOARD",
    "revocation_registry_uri": "https://registry.example/revocations/BOARD-2026-P1",
    "presentation_proof_type": "plain",
    "exam_id": "BOARD-2026-P1",
    "centre_binding": "centre:C012",
    "form_id": "2026-P1-A",
    "language": "en",
    "unlock_window": { "start": "2026-10-11T08:50:00+05:30", "end": "2026-10-11T09:15:00+05:30" },
    "quorum_policy": "2-of-3",
    "payload_sha256": "9f3a4c7e1b2d8a6f0e5c3b9d7a1f4e8c2b6d0a9f3e7c1b5d8a2f6e0c4b9d3a7e",
    "watermark_commitment": "wm:blake3:44d1a0c3",
    "policy_variance_ref": null
  },
  "payload": "<ciphertext, encrypted to centre C012's quorum content key>",
  "keyShares": [
    "<share wrapped to centre.super credential key>",
    "<share wrapped to centre.observer credential key>",
    "<share wrapped to centre.boardrep credential key>"
  ],
  "proof": {
    "type": "DataIntegrityProof",
    "verificationMethod": "vc:example:assembler:BOARD-authority#key-1",
    "created": "2026-10-04T14:02:11+05:30",
    "proofValue": "z3FXQ…"
  }
}
